title,date,datetime,tokens,score
PRESS RELEASE: Cosmo Cuts at Nashoba Tech to reopen next week,Yesterday,2023-10-16 21:47:21.843216,"['press', 'release', 'cosmo', 'cuts', 'nashoba', 'tech', 'reopen', 'next', 'week']",-0.296
'Cosmos cubes' colorfully brighten autumn at west Japan temple ...,Yesterday,2023-10-16 21:47:21.843038,"['cosmos', 'cubes', 'colorfully', 'brighten', 'autumn', 'west', 'japan', 'temple']",0.4404
Explained: What is a space telescope and how does it work?,Yesterday,2023-10-16 21:47:21.842536,"['explained', 'space', 'telescope', 'work']",0.0
The subtle art and psychology of video game horror,Yesterday,2023-10-16 21:47:21.841832,"['subtle', 'art', 'psychology', 'video', 'game', 'horror']",-0.5719
VIOSO reaches for the Cosmos at Turkish theatre,Yesterday,2023-10-16 21:47:21.841334,"['vioso', 'reaches', 'cosmos', 'turkish', 'theatre']",0.0516
Diageo Cocktail Collection Is Premium Line of Bottled Negronis ...,Yesterday,2023-10-16 21:47:21.841334,"['diageo', 'cocktail', 'collection', 'premium', 'line', 'bottled', 'negronis']",0.0
From Cosmos (ATOM) and Tron (TRX) to Everlodge (ELDG): How ...,Yesterday,2023-10-16 21:47:21.840656,"['cosmos', 'atom', 'tron', 'trx', 'everlodge', 'eldg']",0.0
Cosmos (ATOM): How Does it Rank Monday on Long-Term Trading Metrics?,Yesterday,2023-10-16 21:47:21.840304,"['cosmos', 'atom', 'rank', 'monday', 'longterm', 'trading', 'metrics']",0.0
Cosmos is bearish as analysts predict Polkadot to retest $2 ...,Yesterday,2023-10-16 21:47:21.839980,"['cosmos', 'bearish', 'analysts', 'predict', 'polkadot', 'retest']",0.0
Patagonia fossil site unearths evidence from the end of the dinosaur ...,2 days ago,2023-10-15 21:48:46.034228,"['patagonia', 'fossil', 'site', 'unearths', 'evidence', 'end', 'dinosaur']",0.0
"8 Best Nihilistic Games, Ranked",2 days ago,2023-10-15 21:48:46.029542,"['best', 'nihilistic', 'games', 'ranked']",0.6369
Astrologers reveal: unprecedented luck awaits these zodiacs in the ...,2 days ago,2023-10-15 21:48:46.022542,"['astrologers', 'reveal', 'unprecedented', 'luck', 'awaits', 'zodiacs']",0.5106
Patagonia fossil site unearths evidence from the end of the dinosaur ...,2 days ago,2023-10-15 21:47:21.854219,"['patagonia', 'fossil', 'site', 'unearths', 'evidence', 'end', 'dinosaur']",0.0
"8 Best Nihilistic Games, Ranked",2 days ago,2023-10-15 21:47:21.850004,"['best', 'nihilistic', 'games', 'ranked']",0.6369
Astrologers reveal: unprecedented luck awaits these zodiacs in the ...,2 days ago,2023-10-15 21:47:21.843495,"['astrologers', 'reveal', 'unprecedented', 'luck', 'awaits', 'zodiacs']",0.5106
NEC、社内ITの本番環境にIBMのITインフラ可視化ソリューションを ...,2 hours ago,2023-10-17 19:28:56.724027,['necitibmit'],0.0
IBMが生成AIでモダナイズ、COBOLを「JaBOL」ではなく ...,4 hours ago,2023-10-17 17:28:56.735092,['ibmaicoboljabol'],0.0
"Sirion geht Partnerschaft mit IBM ein, um das Vertragsmanagement ...",4 hours ago,2023-10-17 17:28:56.733333,"['sirion', 'geht', 'partnerschaft', 'mit', 'ibm', 'ein', 'um', 'das', 'vertragsmanagement']",0.0
The Expected Move and the Normal Distribution,4 hours ago,2023-10-17 17:28:56.722149,"['expected', 'move', 'normal', 'distribution']",0.0
Díaz Ayuso anuncia una colaboración con IBM para aplicar ...,4 hours ago,2023-10-17 17:28:56.717999,"['daz', 'ayuso', 'anuncia', 'una', 'colaboracin', 'con', 'ibm', 'para', 'aplicar']",0.0
2023-2024 Wittenberg Series Continues,4 hours ago,2023-10-17 17:28:56.717396,"['wittenberg', 'series', 'continues']",0.0
IBM Says 631K Affected in Johnson & Johnson Database Breach,4 hours ago,2023-10-17 17:28:56.715680,"['ibm', 'says', 'k', 'affected', 'johnson', 'johnson', 'database', 'breach']",-0.1531
Large Corporations Continue to Remove Degree Requirements for ...,5 hours ago,2023-10-17 16:28:56.733254,"['large', 'corporations', 'continue', 'remove', 'degree', 'requirements']",0.0
Collaborazione Sirion - IBM destinata a velocizzare la gestione dei ...,5 hours ago,2023-10-17 16:28:56.731285,"['collaborazione', 'sirion', 'ibm', 'destinata', 'velocizzare', 'la', 'gestione', 'dei']",0.0
"William Stanick Obituary (03/11/1933 - 10/07/2023) - Homewood, AL ...",5 hours ago,2023-10-17 16:28:56.721581,"['william', 'stanick', 'obituary', 'homewood', 'al']",0.0
Nancy Alden Obituary - Poughkeepsie Journal,5 hours ago,2023-10-17 16:28:56.719854,"['nancy', 'alden', 'obituary', 'poughkeepsie', 'journal']",0.0
Clifton A. Tynes Obituary - Poughkeepsie Journal,5 hours ago,2023-10-17 16:28:56.718837,"['clifton', 'tynes', 'obituary', 'poughkeepsie', 'journal']",0.0
"‘No evidence’ pro-Palestinian hackers stole Iron Dome data IBM says, despite claims online",6 hours ago,2023-10-17 15:28:56.736344,"['evidence', 'propalestinian', 'hackers', 'stole', 'iron', 'dome', 'data', 'ibm', 'says', 'despite', 'claims', 'online']",0.0
"Tonia Gaffney Obituary (1951 - 2023) - Branford, CT - New Haven ...",6 hours ago,2023-10-17 15:28:56.732482,"['tonia', 'gaffney', 'obituary', 'branford', 'ct', 'new']",0.0
IBM and EY launch AI collaboration,6 hours ago,2023-10-17 15:28:56.715680,"['ibm', 'ey', 'launch', 'ai', 'collaboration']",0.0
Luteinizing Hormone/Human Chorionic Gonadotropin Receptor ...,7 hours ago,2023-10-17 14:28:56.744653,"['luteinizing', 'hormonehuman', 'chorionic', 'gonadotropin', 'receptor']",0.0
CTRL+ALT+DELETE y otros extraños orígenes de comandos en los ordenadores,7 hours ago,2023-10-17 14:28:56.741756,"['ctrlaltdelete', 'otros', 'extraos', 'orgenes', 'de', 'comandos', 'en', 'los', 'ordenadores']",0.0
Rent Group announces Chris Huff as Chief Technology Officer,7 hours ago,2023-10-17 14:28:56.740759,"['rent', 'group', 'announces', 'chris', 'huff', 'chief', 'technology', 'officer']",0.0
Carol Ann Lisowy - Riverhead News Review,7 hours ago,2023-10-17 14:28:56.730285,"['carol', 'ann', 'lisowy', 'riverhead', 'news', 'review']",0.0
University of Kentucky unlocks 60% cut in IT costs with Apple,7 hours ago,2023-10-17 14:28:56.728223,"['university', 'kentucky', 'unlocks', 'cut', 'costs', 'apple']",-0.2732
Israel journey: Group from Tabernacle Church of Utica returns home,7 hours ago,2023-10-17 14:28:56.727695,"['israel', 'journey', 'group', 'tabernacle', 'church', 'utica', 'returns', 'home']",0.0
Quantum Computing Projects for Beginners to Try in 2023,7 hours ago,2023-10-17 14:28:56.727008,"['quantum', 'computing', 'projects', 'beginners', 'try']",0.0
AI Update: SEC Data Analytics Proposal,7 hours ago,2023-10-17 14:28:56.725075,"['ai', 'update', 'sec', 'data', 'analytics', 'proposal']",0.0
Helping The Helpers: The Nanny Relief Fund Supports A Community Of Workers In A Volatile Industry,7 hours ago,2023-10-17 14:28:56.722149,"['helping', 'helpers', 'nanny', 'relief', 'fund', 'supports', 'community', 'workers', 'volatile', 'industry']",0.836
Companies Need To Get Serious About Materiality,7 hours ago,2023-10-17 14:28:56.721581,"['companies', 'need', 'get', 'serious', 'materiality']",-0.0772
Semiconductor Industry Set To Electrify Over Next Decade,8 hours ago,2023-10-17 13:28:56.743773,"['semiconductor', 'industry', 'set', 'electrify', 'next', 'decade']",0.0
SEMO Holds First Ever Homecoming Block Party on 150th ...,8 hours ago,2023-10-17 13:28:56.743461,"['semo', 'holds', 'first', 'ever', 'homecoming', 'block', 'party', 'th']",-0.0516
Depression in Patients With Parkinson's Disease: A Hospital-Based ...,8 hours ago,2023-10-17 13:28:56.740759,"['depression', 'patients', 'parkinsons', 'disease', 'hospitalbased']",-0.5719
How Entrepreneurs Can Empower Consumers to Make Sustainable ...,8 hours ago,2023-10-17 13:28:56.739757,"['entrepreneurs', 'empower', 'consumers', 'make', 'sustainable']",0.0
Ecco gli ultimi rating degli analisti per IBM,8 hours ago,2023-10-17 13:28:56.738756,"['ecco', 'gli', 'ultimi', 'rating', 'degli', 'analisti', 'per', 'ibm']",0.0
Four indicted for hiring locals for Chinese firms,8 hours ago,2023-10-17 13:28:56.733940,"['four', 'indicted', 'hiring', 'locals', 'chinese', 'firms']",0.0
Population Health Management Market size worth USD 64.12 Billion ...,8 hours ago,2023-10-17 13:28:56.725075,"['population', 'health', 'management', 'market', 'size', 'worth', 'usd', 'billion']",0.2263
"Meet Tom Eck, Fiserv Senior VP Of Digital Transformation, At ...",8 hours ago,2023-10-17 13:28:56.724418,"['meet', 'tom', 'eck', 'fiserv', 'senior', 'vp', 'digital', 'transformation']",0.0
Weather Words: 'Pentad' | Weather.com,8 hours ago,2023-10-17 13:28:56.723012,"['weather', 'words', 'pentad', 'weathercom']",0.0
NIST Announces New Board Members to Launch Semiconductor ...,8 hours ago,2023-10-17 13:28:56.718837,"['nist', 'announces', 'new', 'board', 'members', 'launch', 'semiconductor']",0.0
Rising AI Use Paired With Layoffs Invites Age Bias Litigation,8 hours ago,2023-10-17 13:28:56.716950,"['rising', 'ai', 'use', 'paired', 'layoffs', 'invites', 'age', 'bias', 'litigation']",-0.296
Morgan Stanley Maintains International Business Machines (IBM ...,8 hours ago,2023-10-17 13:28:56.714659,"['morgan', 'stanley', 'maintains', 'international', 'business', 'machines', 'ibm']",0.0
SingleStore Announces Several New Product Innovations to Unlock ...,9 hours ago,2023-10-17 12:28:56.744334,"['singlestore', 'announces', 'several', 'new', 'product', 'innovations', 'unlock']",0.0
Phillip Davis Obituary - Bills-McGaugh & Hamilton Funeral Home ...,9 hours ago,2023-10-17 12:28:56.735998,"['phillip', 'davis', 'obituary', 'billsmcgaugh', 'hamilton', 'funeral', 'home']",-0.3612
Half a Million Employees Will Be Forced Back to the Office by ...,9 hours ago,2023-10-17 12:28:56.733940,"['half', 'million', 'employees', 'forced', 'back', 'office']",-0.4588
Digital Twin Market Expected To Achieve USD 274.2 Billion by 2032 ...,9 hours ago,2023-10-17 12:28:56.720497,"['digital', 'twin', 'market', 'expected', 'achieve', 'usd', 'billion']",0.0
UTA expands microcredential program to all Mavericks - News ...,9 hours ago,2023-10-17 12:28:56.720236,"['uta', 'expands', 'microcredential', 'program', 'mavericks', 'news']",0.1027
Nick Kadochnikov joins Harbor as head of artificial intelligence,9 hours ago,2023-10-17 12:28:56.717396,"['nick', 'kadochnikov', 'joins', 'harbor', 'head', 'artificial', 'intelligence']",0.4767
Analyst Expectations for IBM's Future - IBM (NYSE:IBM),9 hours ago,2023-10-17 12:28:56.716398,"['analyst', 'expectations', 'ibms', 'future', 'ibm', 'nyseibm']",0.0
Dow Jones 30 Industrial-Wert IBM-Aktie: So viel hätten Anleger mit einem Investment in IBM verdient,10 hours ago,2023-10-17 11:28:56.742757,"['dow', 'jones', 'industrialwert', 'ibmaktie', 'viel', 'htten', 'anleger', 'mit', 'einem', 'investment', 'ibm', 'verdient']",0.0
"Jason Keenaghan, Author at TechSpective",10 hours ago,2023-10-17 11:28:56.740759,"['jason', 'keenaghan', 'author', 'techspective']",0.0
Texas A&M University System Modernizes Legacy Mainframe with ...,10 hours ago,2023-10-17 11:28:56.721581,"['texas', 'university', 'system', 'modernizes', 'legacy', 'mainframe']",0.0
11 Best Quantum Computing Stocks To Buy Now,10 hours ago,2023-10-17 11:28:56.720497,"['best', 'quantum', 'computing', 'stocks', 'buy']",0.6369
Lowell R. Meyer,10 hours ago,2023-10-17 11:28:56.718837,"['lowell', 'r', 'meyer']",0.0
"UAlbany, IBM partner to advance AI in New York state",10 hours ago,2023-10-17 11:28:56.713983,"['ualbany', 'ibm', 'partner', 'advance', 'ai', 'new', 'york', 'state']",0.0
Sirion werkt samen met IBM om Enterprise Contract Management te ...,11 hours ago,2023-10-17 10:28:56.743773,"['sirion', 'werkt', 'samen', 'met', 'ibm', 'om', 'enterprise', 'contract', 'management', 'te']",0.0
DeSantis is all wrong about the Palestinian people | Letters to the ...,11 hours ago,2023-10-17 10:28:56.737759,"['desantis', 'wrong', 'palestinian', 'people', 'letters']",-0.4767
SEC Launches Investigation into Progress Software's MOVEit Hack,11 hours ago,2023-10-17 10:28:56.737759,"['sec', 'launches', 'investigation', 'progress', 'softwares', 'moveit', 'hack']",0.4215
Encourage Your Customers to Call Again. Here’s How.,11 hours ago,2023-10-17 10:28:56.735092,"['encourage', 'customers', 'call', 'heres']",0.5106
"Anthony Cistone Obituary - DellaVecchia, Reilly, Smith & Boyd ...",11 hours ago,2023-10-17 10:28:56.732482,"['anthony', 'cistone', 'obituary', 'dellavecchia', 'reilly', 'smith', 'boyd']",0.0
Can AI bias be fixed?,11 hours ago,2023-10-17 10:28:56.729255,"['ai', 'bias', 'fixed']",-0.1027
Sirion Partners with IBM to Accelerate Enterprise Contract ...,11 hours ago,2023-10-17 10:28:56.714659,"['sirion', 'partners', 'ibm', 'accelerate', 'enterprise', 'contract']",0.0
"The Best Stocks to Invest $50,000 in Right Now",12 hours ago,2023-10-17 09:28:56.743162,"['best', 'stocks', 'invest', 'right']",0.6369
ZainTECH to acquire STS to expand its service offerings,12 hours ago,2023-10-17 09:28:56.741756,"['zaintech', 'acquire', 'sts', 'expand', 'service', 'offerings']",0.3182
Grid security must be ensured through technology: Nasrul Hamid ...,12 hours ago,2023-10-17 09:28:56.738756,"['grid', 'security', 'must', 'ensured', 'technology', 'nasrul', 'hamid']",0.34
HUD and the Concept of the Smart City | HUD USER,12 hours ago,2023-10-17 09:28:56.737759,"['hud', 'concept', 'smart', 'city', 'hud', 'user']",0.4019
IBM : Morgan Stanley n'est pas inspiré par le dossier,12 hours ago,2023-10-17 09:28:56.731285,"['ibm', 'morgan', 'stanley', 'nest', 'pas', 'inspir', 'par', 'le', 'dossier']",0.0
Samuel Jay Speyer,12 hours ago,2023-10-17 09:28:56.730285,"['samuel', 'jay', 'speyer']",0.0
What Is Neuromorphic Computing?,12 hours ago,2023-10-17 09:28:56.725582,"['neuromorphic', 'computing']",0.0
JPMorgan's most unique tech internships pay up to $3k per week,12 hours ago,2023-10-17 09:28:56.723012,"['jpmorgans', 'unique', 'tech', 'internships', 'pay', 'k', 'per', 'week']",-0.1027
"Longer Commutes, Shorter Lives: The Costs of Not Investing in ...",12 hours ago,2023-10-17 09:28:56.721324,"['longer', 'commutes', 'shorter', 'lives', 'costs', 'investing']",0.0
Why Our Forecast Weather Map Is Nearly Blank,12 hours ago,2023-10-17 09:28:56.718837,"['forecast', 'weather', 'map', 'nearly', 'blank']",0.0
Pocketnest Deploys AI to Simplify Financial Planning,12 hours ago,2023-10-17 09:28:56.716950,"['pocketnest', 'deploys', 'ai', 'simplify', 'financial', 'planning']",0.0
Clinical Characteristics and Prognostic Factors of Patients With ...,13 hours ago,2023-10-17 08:28:56.736344,"['clinical', 'characteristics', 'prognostic', 'factors', 'patients']",0.0
A Solution to the Dilemma of Server Proliferation,13 hours ago,2023-10-17 08:28:56.733940,"['solution', 'dilemma', 'server', 'proliferation']",0.1531
Adobe Project Primrose Dress Previews Interactive Textile Technology,13 hours ago,2023-10-17 08:28:56.724992,"['adobe', 'project', 'primrose', 'dress', 'previews', 'interactive', 'textile', 'technology']",0.0
Elda Health launches #AbhiToUmarHai campaign on World Menopause Day,14 hours ago,2023-10-17 07:28:56.744653,"['elda', 'health', 'launches', 'abhitoumarhai', 'campaign', 'world', 'menopause', 'day']",0.0
Software-Defined Data Center Market revenue to reach USD ...,14 hours ago,2023-10-17 07:28:56.729255,"['softwaredefined', 'data', 'center', 'market', 'revenue', 'reach', 'usd']",0.0258
Taiwan charges 4 individuals for helping China poach tech talent,14 hours ago,2023-10-17 07:28:56.727391,"['taiwan', 'charges', 'individuals', 'helping', 'china', 'poach', 'tech', 'talent']",0.4404
クボタ、日本IBMと共同開発したスマート水道工事システムを提供 ...,14 hours ago,2023-10-17 07:28:56.725582,['ibm'],0.0
7 cloud market trends and how they will impact IT,14 hours ago,2023-10-17 07:28:56.720846,"['cloud', 'market', 'trends', 'impact']",0.0
Happiest Minds conferred 'Trailblazers of 2023' at the APAC IBM ...,14 hours ago,2023-10-17 07:28:56.715680,"['happiest', 'minds', 'conferred', 'trailblazers', 'apac', 'ibm']",0.6369
AI and FDI | Two perspectives to consider,15 hours ago,2023-10-17 06:28:56.739757,"['ai', 'fdi', 'two', 'perspectives', 'consider']",0.0
Can thin clients be an antidote to the sprawling attack surface?,15 hours ago,2023-10-17 06:28:56.736344,"['thin', 'clients', 'antidote', 'sprawling', 'attack', 'surface']",-0.4767
"Edward Slezek Obituary (1930 - 2023) - Florence, MA - Daily ...",15 hours ago,2023-10-17 06:28:56.730285,"['edward', 'slezek', 'obituary', 'florence', 'daily']",0.0
Gerald Turecek Obituary - Richards Funeral Home - 2023,15 hours ago,2023-10-17 06:28:56.729255,"['gerald', 'turecek', 'obituary', 'richards', 'funeral', 'home']",-0.3612
PwC Partners with OpenAI to Offer AI-Generated Advice to Clients,15 hours ago,2023-10-17 06:28:56.728223,"['pwc', 'partners', 'openai', 'offer', 'aigenerated', 'advice', 'clients']",0.0
Amazon announces South African launch,16 hours ago,2023-10-17 05:28:56.738756,"['amazon', 'announces', 'south', 'african', 'launch']",0.1779
"Cleveland welcomed nearly 18 million visitors in 2022, almost back to pre-pandemic levels",16 hours ago,2023-10-17 05:28:56.723012,"['cleveland', 'welcomed', 'nearly', 'million', 'visitors', 'almost', 'back', 'prepandemic', 'levels']",0.34
藤田医科大、IBMやAWSと電子カルテ基盤をハイブリッドクラウド ...,17 hours ago,2023-10-17 04:28:56.725582,['ibmaws'],0.0
Generative AI forces Stack Overflow to lay off 28% of its workforce,17 hours ago,2023-10-17 04:28:56.722149,"['generative', 'ai', 'forces', 'stack', 'overflow', 'lay', 'workforce']",0.0
IBM India mulls to upgrade Kochi Software Lab,17 hours ago,2023-10-17 04:28:56.715396,"['ibm', 'india', 'mulls', 'upgrade', 'kochi', 'software', 'lab']",0.0
An Insight Into Tuberculosis Patients in the Chest Clinic of North ...,18 hours ago,2023-10-17 03:28:56.739757,"['insight', 'tuberculosis', 'patients', 'chest', 'clinic', 'north']",0.0
Why India is IBM s Growth Market -Sandip Patel,18 hours ago,2023-10-17 03:28:56.716398,"['india', 'ibm', 'growth', 'market', 'sandip', 'patel']",0.3818
"June Gillespie Obituary - All Faiths Cremation Service, LLC - West ...",19 hours ago,2023-10-17 02:28:56.744653,"['june', 'gillespie', 'obituary', 'faiths', 'cremation', 'service', 'llc', 'west']",0.4215
John Coleman Obituary - Macken Funeral Home & Cremation ...,19 hours ago,2023-10-17 02:28:56.728223,"['john', 'coleman', 'obituary', 'macken', 'funeral', 'home', 'cremation']",-0.3612
Dolores Burke Obituary - Beck Funeral Home in Austin/Round Rock ...,19 hours ago,2023-10-17 02:28:56.723012,"['dolores', 'burke', 'obituary', 'beck', 'funeral', 'home', 'austinround', 'rock']",-0.3612
1923: North polar areas are warming,19 hours ago,2023-10-17 02:28:56.717999,"['north', 'polar', 'areas', 'warming']",0.1531
Sheikh Mohammed: 'Dubai a pivotal hub for tech' tomorrow and ...,20 hours ago,2023-10-17 01:28:56.733940,"['sheikh', 'mohammed', 'dubai', 'pivotal', 'hub', 'tech', 'tomorrow']",0.0
Estimation of Access to Safe Drinking Water to Households in ...,20 hours ago,2023-10-17 01:28:56.732042,"['estimation', 'access', 'safe', 'drinking', 'water', 'households']",0.4404
IBM Offers Research Internship in Artificial Intelligence,20 hours ago,2023-10-17 01:28:56.717999,"['ibm', 'offers', 'research', 'internship', 'artificial', 'intelligence']",0.4767
"Multas millonarias a Indra, IBM y tres grandes empresas más: ""Crearon un entramado y estafaron al Estado""",21 hours ago,2023-10-17 00:28:56.726487,"['multas', 'millonarias', 'indra', 'ibm', 'tres', 'grandes', 'empresas', 'ms', 'crearon', 'un', 'entramado', 'estafaron', 'al', 'estado']",0.0
'You feel like your loved one was taken away unjustly:' Murder of ...,22 hours ago,2023-10-16 23:28:56.724607,"['feel', 'like', 'loved', 'one', 'taken', 'away', 'unjustly', 'murder']",0.1779
"Israel-Hamas war live updates: Israel denies targeting Gaza hospital, Palestinian leader Abbas cancels meeting with Biden",1 hour ago,2023-10-17 22:17:51.398034,"['israelhamas', 'war', 'live', 'updates', 'israel', 'denies', 'targeting', 'gaza', 'hospital', 'palestinian', 'leader', 'abbas', 'cancels', 'meeting', 'biden']",-0.8225
Israel-Hamas war live: deadly Gaza hospital blast sparks protests across Middle East; Biden cancels Jordan visit,1 hour ago,2023-10-17 22:17:51.397035,"['israelhamas', 'war', 'live', 'deadly', 'gaza', 'hospital', 'blast', 'sparks', 'protests', 'across', 'middle', 'east', 'biden', 'cancels', 'jordan', 'visit']",-0.7717
UN Security Council to vote Wednesday on Israel-Gaza conflict,3 hours ago,2023-10-17 20:17:51.403037,"['un', 'security', 'council', 'vote', 'wednesday', 'israelgaza', 'conflict']",0.0258
"DOD Increases Deterrence Posture in Middle East, Continues Aid to ...",3 hours ago,2023-10-17 20:17:51.400037,"['dod', 'increases', 'deterrence', 'posture', 'middle', 'east', 'continues', 'aid']",0.0
Biden considering $100 bln funding request that includes Israel ...,4 hours ago,2023-10-17 19:17:51.406036,"['biden', 'considering', 'bln', 'funding', 'request', 'includes', 'israel']",0.0
Nonprofit that flew Americans from Israel to Florida for DeSantis releases new details,4 hours ago,2023-10-17 19:17:51.403037,"['nonprofit', 'flew', 'americans', 'israel', 'florida', 'desantis', 'releases', 'new', 'details']",0.0
Canadian prime minister calls reported Israeli strike on hospital ...,4 hours ago,2023-10-17 19:17:51.402036,"['canadian', 'prime', 'minister', 'calls', 'reported', 'israeli', 'strike', 'hospital']",-0.128
Biden's Middle East goal: Back Israel and don't get sucked into war,4 hours ago,2023-10-17 19:17:51.401028,"['bidens', 'middle', 'east', 'goal', 'back', 'israel', 'dont', 'get', 'sucked', 'war']",0.6834
Israel Instagram account blasts Gigi Hadid,5 hours ago,2023-10-17 18:17:51.410309,"['israel', 'instagram', 'account', 'blasts', 'gigi', 'hadid']",0.0
The Israel-Hamas War Is Testing China's Diplomatic Strategy,5 hours ago,2023-10-17 18:17:51.402036,"['israelhamas', 'war', 'testing', 'chinas', 'diplomatic', 'strategy']",-0.5994
A guide to Elon Musk's latest battle over disinformation on X,5 hours ago,2023-10-17 18:17:51.397035,"['guide', 'elon', 'musks', 'latest', 'battle', 'disinformation', 'x']",-0.3818
"Biden has 'tough questions' for Netanyahu, Gaza strike upends ...",5 hours ago,2023-10-17 18:17:51.394893,"['biden', 'tough', 'questions', 'netanyahu', 'gaza', 'strike', 'upends']",-0.25
Tlaib criticizes Biden after Israel strikes hospital in Gaza: 'We will ...,6 hours ago,2023-10-17 17:17:51.410036,"['tlaib', 'criticizes', 'biden', 'israel', 'strikes', 'hospital', 'gaza']",-0.5994
At least 15 journalists killed in Hamas-Israel war,6 hours ago,2023-10-17 17:17:51.400037,"['least', 'journalists', 'killed', 'hamasisrael', 'war']",-0.8555
The Israel-Hamas War: The Humanitarian Crisis in Gaza,6 hours ago,2023-10-17 17:17:51.394893,"['israelhamas', 'war', 'humanitarian', 'crisis', 'gaza']",-0.8402
Free meals for Israeli soldiers divide McDonald's franchises over ...,7 hours ago,2023-10-17 16:17:51.415444,"['free', 'meals', 'israeli', 'soldiers', 'divide', 'mcdonalds', 'franchises']",0.5106
Scoop: White House has discussed U.S. military response if ...,7 hours ago,2023-10-17 16:17:51.415444,"['scoop', 'white', 'house', 'discussed', 'us', 'military', 'response']",0.1531
Opinion | What Joe Biden Did Right on Israel and Hamas,7 hours ago,2023-10-17 16:17:51.414449,"['opinion', 'joe', 'biden', 'right', 'israel', 'hamas']",0.0
First batch of U.S. citizens leaving Israel arrive in Cyprus by boat,7 hours ago,2023-10-17 16:17:51.412452,"['first', 'batch', 'us', 'citizens', 'leaving', 'israel', 'arrive', 'cyprus', 'boat']",0.0
‘He’s unfit’: Israel fiercely divided over Netanyahu’s hostage response,7 hours ago,2023-10-17 16:17:51.409036,"['hes', 'unfit', 'israel', 'fiercely', 'divided', 'netanyahus', 'hostage', 'response']",0.0
EU leaders to focus on fallout from Hamas attack on Israel,7 hours ago,2023-10-17 16:17:51.401028,"['eu', 'leaders', 'focus', 'fallout', 'hamas', 'attack', 'israel']",-0.4767
What Putin Stands to Gain From Israel-Hamas War,7 hours ago,2023-10-17 16:17:51.401028,"['putin', 'stands', 'gain', 'israelhamas', 'war']",-0.128
Why are Israel and Hamas at war? A basic explainer.,7 hours ago,2023-10-17 16:17:51.397035,"['israel', 'hamas', 'war', 'basic', 'explainer']",-0.5994
Israel-Hamas war: Is the two-state solution dead?,8 hours ago,2023-10-17 15:17:51.419452,"['israelhamas', 'war', 'twostate', 'solution', 'dead']",-0.7845
Tensions surge at US universities as students rally over Israel-Hamas war,8 hours ago,2023-10-17 15:17:51.413455,"['tensions', 'surge', 'us', 'universities', 'students', 'rally', 'israelhamas', 'war']",-0.765
Jordan warns Middle East is at edge of 'abyss',8 hours ago,2023-10-17 15:17:51.411452,"['jordan', 'warns', 'middle', 'east', 'edge', 'abyss']",-0.1027
How Does Israel's Last Invasion of Gaza Compare to Now?,8 hours ago,2023-10-17 15:17:51.410309,"['israels', 'last', 'invasion', 'gaza', 'compare']",0.0
Iran’s Khamenei demands Israel stop bombardment of Gaza,8 hours ago,2023-10-17 15:17:51.408031,"['irans', 'khamenei', 'demands', 'israel', 'stop', 'bombardment', 'gaza']",-0.296
"Rishi Sunak could visit Israel as soon as Thursday, Sky News understands",8 hours ago,2023-10-17 15:17:51.407036,"['rishi', 'sunak', 'could', 'visit', 'israel', 'soon', 'thursday', 'sky', 'news', 'understands']",0.0
Hamas admits Israel killed a top commander,8 hours ago,2023-10-17 15:17:51.404033,"['hamas', 'admits', 'israel', 'killed', 'top', 'commander']",-0.3612
Why Fed officials aren’t addressing the Israel-Hamas war the way they did with Ukraine,9 hours ago,2023-10-17 14:17:51.421451,"['fed', 'officials', 'arent', 'addressing', 'israelhamas', 'war', 'way', 'ukraine']",0.4847
The laws of war must guide Israel's response to Hamas atrocity,9 hours ago,2023-10-17 14:17:51.404033,"['laws', 'war', 'must', 'guide', 'israels', 'response', 'hamas', 'atrocity']",-0.5994
Aid still unreachable after Israel bombs region where civilians were told to flee,9 hours ago,2023-10-17 14:17:51.393650,"['aid', 'still', 'unreachable', 'israel', 'bombs', 'region', 'civilians', 'told', 'flee']",0.0
