title,date,datetime,tokens,score
Trump is winning in key swing states as voters reject Bidenomics: poll,3 days ago,2023-10-19 19:22:10.233426,"['trump', 'winning', 'key', 'swing', 'states', 'voters', 'reject', 'bidenomics', 'poll']",0.1779
"Global IT Spending Forecast To Grow 8 Percent In 2024, Solution ...",3 days ago,2023-10-19 19:22:10.221361,"['global', 'spending', 'forecast', 'grow', 'percent', 'solution']",0.3182
How Deeply Will Fed Policy Lags Impact the Economy in 2024 ...,5 days ago,2023-10-17 19:22:10.235429,"['deeply', 'fed', 'policy', 'lags', 'impact', 'economy']",-0.4144
South Africa predicted to briefly lead Africa's economy in 2024 By ...,5 days ago,2023-10-17 19:22:10.229255,"['south', 'africa', 'predicted', 'briefly', 'lead', 'africas', 'economy']",0.0
Recession 2024: Are We On The Brink Of An Economic Downturn?,5 days ago,2023-10-17 19:22:10.226800,"['recession', 'brink', 'economic', 'downturn']",-0.4215
Harry Dent: ‘Crash of a Lifetime’ Coming in 2024,6 days ago,2023-10-16 19:22:10.233426,"['harry', 'dent', 'crash', 'lifetime', 'coming']",-0.4019
High interest rates weigh on GDP but UK on course to avoid recession,6 days ago,2023-10-16 19:22:10.225553,"['high', 'interest', 'rates', 'weigh', 'gdp', 'uk', 'course', 'avoid', 'recession']",-0.25
MBA Forecast: Mortgage Originations to Increase 19% to $1.95 ...,7 days ago,2023-10-15 19:22:10.222584,"['mba', 'forecast', 'mortgage', 'originations', 'increase']",0.3182
DBRS Morningstar's Takeaways from Credit Outlook Canada 2024 ...,9 days ago,2023-10-13 19:22:10.231427,"['dbrs', 'morningstars', 'takeaways', 'credit', 'outlook', 'canada']",0.3818
Billionaire Paul Tudor Jones Predicts a Recession in Early 2024 ...,10 days ago,2023-10-12 19:22:10.229867,"['billionaire', 'paul', 'tudor', 'jones', 'predicts', 'recession', 'early']",-0.4215
Nucleus Research Announces Top Ten Predictions for 2024,10 days ago,2023-10-12 19:22:10.229867,"['nucleus', 'research', 'announces', 'top', 'ten', 'predictions']",0.2023
"IEA, OPEC predictions of 2024 oil demand growth diverge further",10 days ago,2023-10-12 19:22:10.226185,"['iea', 'opec', 'predictions', 'oil', 'demand', 'growth', 'diverge']",0.2732
Italy Significantly Loosens Its Fiscal Plans,11 days ago,2023-10-11 19:22:10.228029,"['italy', 'significantly', 'loosens', 'fiscal', 'plans']",0.0
IMF Lowers Russia’s 2024 GDP Growth Forecast,11 days ago,2023-10-11 19:22:10.223191,"['imf', 'lowers', 'russias', 'gdp', 'growth', 'forecast']",0.2732
"‘Limping’ Global Economy Will See Slower Growth In 2024, IMF Projects",12 days ago,2023-10-10 19:22:10.220758,"['limping', 'global', 'economy', 'see', 'slower', 'growth', 'imf', 'projects']",0.3818
Wichita's economic outlook continues to show signs of growth into ...,17 days ago,2023-10-05 19:22:10.223713,"['wichitas', 'economic', 'outlook', 'continues', 'show', 'signs', 'growth']",0.3818
U.S. faces stagflation risk in 2024: Eurasia Group economist,18 days ago,2023-10-04 19:22:10.234427,"['us', 'faces', 'stagflation', 'risk', 'eurasia', 'group', 'economist']",-0.2732
COLA Increase 2024: What day is the adjustment for next year being released?,19 days ago,2023-10-03 19:22:10.228648,"['cola', 'increase', 'day', 'adjustment', 'next', 'year', 'released']",0.3182
Will the U.S. Get Hit With a Recession in 2024?,19 days ago,2023-10-03 19:22:10.220758,"['us', 'get', 'hit', 'recession']",-0.4215
Q4 Stock Predictions: 3 Tech Funds Ready to Roar Into 2024,20 days ago,2023-10-02 19:22:10.234427,"['q', 'stock', 'predictions', 'tech', 'funds', 'ready', 'roar']",0.3612
World Bank predicts slowdown in East Asia and Pacific economies ...,20 days ago,2023-10-02 19:22:10.232426,"['world', 'bank', 'predicts', 'slowdown', 'east', 'asia', 'pacific', 'economies']",0.0
France Maintains Large 2024 Deficit Target in Slow Fiscal ...,20 days ago,2023-10-02 19:22:10.232426,"['france', 'maintains', 'large', 'deficit', 'target', 'slow', 'fiscal']",-0.4019
Radio Ink Announces The Forecast 2024 Lineup,20 days ago,2023-10-02 19:22:10.230389,"['radio', 'ink', 'announces', 'forecast', 'lineup']",0.0
EU Lowers 2023-2024 Economic Forecasts,Sep 11,,"['eu', 'lowers', 'economic', 'forecasts']",-0.128
Summer 2023 Economic Forecast: Easing growth momentum amid ...,Sep 11,,"['summer', 'economic', 'forecast', 'easing', 'growth', 'momentum', 'amid']",0.5574
EU Commission cuts euro zone growth forecast as Germany in ...,Sep 11,,"['eu', 'commission', 'cuts', 'euro', 'zone', 'growth', 'forecast', 'germany']",0.1027
"Fed keeps rates steady, toughens policy stance as 'soft landing ...",Sep 20,,"['fed', 'keeps', 'rates', 'steady', 'toughens', 'policy', 'stance', 'soft', 'landing']",-0.0516
Federal Reserve signals fresh rate rise this year and fewer cuts in ...,Sep 20,,"['federal', 'reserve', 'signals', 'fresh', 'rate', 'rise', 'year', 'fewer', 'cuts']",0.0258
Fed Pauses Interest Rate Hikes Again—But Ups Long-Term Forecast,Sep 20,,"['fed', 'pauses', 'interest', 'rate', 'hikes', 'againbut', 'ups', 'longterm', 'forecast']",0.4588
"Moody's lifts 2023 U.S. growth forecast, cuts China's for 2024",Sep 1,,"['moodys', 'lifts', 'us', 'growth', 'forecast', 'cuts', 'chinas']",0.1027
US economic outlook: a cooler climate as the US economy enters Q4,Sep 26,,"['us', 'economic', 'outlook', 'cooler', 'climate', 'us', 'economy', 'enters', 'q']",0.0
World Growth Outlook for 2024 Deteriorates as China Risks Rise,Sep 13,,"['world', 'growth', 'outlook', 'deteriorates', 'china', 'risks', 'rise']",0.128
Economists grow gloomier on 2024 as central banks delay rate cuts,Sep 3,,"['economists', 'grow', 'gloomier', 'central', 'banks', 'delay', 'rate', 'cuts']",-0.7184
"Russia hikes inflation forecast, sees much weaker rouble - economy ...",Sep 12,,"['russia', 'hikes', 'inflation', 'forecast', 'sees', 'much', 'weaker', 'rouble', 'economy']",-0.4404
"China 2023 GDP growth forecast cut to 5.0%, 4.5% in 2024, Reuters ...",Sep 11,,"['china', 'gdp', 'growth', 'forecast', 'cut', 'reuters']",0.128
"German GDP expected to contract 0.6% this year, economic ...",Sep 28,,"['german', 'gdp', 'expected', 'contract', 'year', 'economic']",0.0
C.A.R. releases its 2024 California Housing Market Forecast,Sep 20,,"['car', 'releases', 'california', 'housing', 'market', 'forecast']",0.0
"U.S. will likely avert recession in 2024, bank economists say",Sep 11,,"['us', 'likely', 'avert', 'recession', 'bank', 'economists', 'say']",-0.5423
"Lower Inflation, GDP Growth Improve U.S. Outlook",Aug 30,,"['lower', 'inflation', 'gdp', 'growth', 'improve', 'us', 'outlook']",0.5106
Powell warns strong economy could lead to new interest rate hikes,Aug 25,,"['powell', 'warns', 'strong', 'economy', 'could', 'lead', 'new', 'interest', 'rate', 'hikes']",0.7096
BCC Economic Forecast: Fragile Economy Stuck In First Gear,Sep 6,,"['bcc', 'economic', 'forecast', 'fragile', 'economy', 'stuck', 'first', 'gear']",-0.25
The 10 Biggest Business Trends For 2024 Everyone Must Be Ready For Now,Sep 25,,"['biggest', 'business', 'trends', 'everyone', 'must', 'ready']",0.3612
Housing market prediction 2024: Mild recession ‘likeliest outcome’,Sep 20,,"['housing', 'market', 'prediction', 'mild', 'recession', 'likeliest', 'outcome']",-0.4215
China's economy: Forecasters slash growth outlooks for 2023 and 2024,Aug 29,,"['chinas', 'economy', 'forecasters', 'slash', 'growth', 'outlooks']",0.128
Fed to leave rates unchanged on Sept. 20; cut unlikely before Q2 ...,Sep 13,,"['fed', 'leave', 'rates', 'unchanged', 'sept', 'cut', 'unlikely', 'q']",-0.3182
New Zealand forecasts much larger budget deficit but improved ...,Sep 11,,"['new', 'zealand', 'forecasts', 'much', 'larger', 'budget', 'deficit', 'improved']",0.1027
Special Report: Key Business Costs for 2024 | Kiplinger,Sep 1,,"['special', 'report', 'key', 'business', 'costs', 'kiplinger']",0.4019
Virginia Realtors Association looks ahead to 2024 economic and housing markets,Sep 27,,"['virginia', 'realtors', 'association', 'looks', 'ahead', 'economic', 'housing', 'markets']",0.0
"UK workers will be worse off in 2024 than in 2019, thinktank warns",Sep 5,,"['uk', 'workers', 'worse', 'thinktank', 'warns']",-0.5423
"Mexico 2024 Budget to Lead to Moderate Debt Increase, Confirms ...",Sep 14,,"['mexico', 'budget', 'lead', 'moderate', 'debt', 'increase', 'confirms']",-0.0516
"Canadian Economy to Rebound in 2024, Deloitte Canada Forecasts ...",Sep 28,,"['canadian', 'economy', 'rebound', 'deloitte', 'canada', 'forecasts']",0.0
Goldman Sachs cuts US recession odds to 15% as economic ...,Sep 5,,"['goldman', 'sachs', 'cuts', 'us', 'recession', 'odds', 'economic']",-0.6124
9 Inflation-Related Tax Predictions for 2024 Retirement Planning,Sep 15,,"['inflationrelated', 'tax', 'predictions', 'retirement', 'planning']",0.0
"Nomura, Morgan Stanley raise India's fiscal 2024 economic growth ...",Sep 1,,"['nomura', 'morgan', 'stanley', 'raise', 'indias', 'fiscal', 'economic', 'growth']",0.3818
What a Bunch of Dots Say About The Future Of Your Finances,Sep 21,,"['bunch', 'dots', 'say', 'future', 'finances']",0.0
"Government files 2024 budget, treatment is expected after the ...",Sep 16,,"['government', 'files', 'budget', 'treatment', 'expected']",0.0
Why ‘Bidenomics’ Isn’t Working For Biden,Sep 12,,"['bidenomics', 'isnt', 'working', 'biden']",0.0
Canada’s economic engine is gearing down,Sep 13,,"['canadas', 'economic', 'engine', 'gearing']",0.0
Global advertising spend forecast to surpass $1trn in 2024,Aug 24,,"['global', 'advertising', 'spend', 'forecast', 'surpass', 'trn']",0.0
Will there be a recession? Probability differs across the U.S.,Sep 12,,"['recession', 'probability', 'differs', 'across', 'us']",-0.4215
Bank of Canada hikes likely won’t continue into 2024: expert,Sep 26,,"['bank', 'canada', 'hikes', 'likely', 'wont', 'continue', 'expert']",0.0
Dollar to strengthen well into 2024 says HSBC,Sep 8,,"['dollar', 'strengthen', 'well', 'says', 'hsbc']",0.5267
Russell Investments' Q4 2023 Global Market Outlook: Strategists ...,Sep 26,,"['russell', 'investments', 'q', 'global', 'market', 'outlook', 'strategists']",0.0
When Might The Fed Cut Interest Rates?,Sep 5,,"['might', 'fed', 'cut', 'interest', 'rates']",0.2263
Korea's GDP growth expected to fall short of 2% in 2024,Sep 8,,"['koreas', 'gdp', 'growth', 'expected', 'fall', 'short']",0.3818
Housing Market 2024,Aug 24,,"['housing', 'market']",0.0
Inflation Projections For Corporate Budgets In 2024 And Beyond,Sep 13,,"['inflation', 'projections', 'corporate', 'budgets', 'beyond']",0.0
Balancing act: Disinflation and recession,Sep 15,,"['balancing', 'act', 'disinflation', 'recession']",-0.4215
"Bank of Canada not expected to cut rates before Q2 2024, new ...",Sep 14,,"['bank', 'canada', 'expected', 'cut', 'rates', 'q', 'new']",-0.2732
Attention! Virtual Summit by eMarketer: Predictions for 2024,Sep 15,,"['attention', 'virtual', 'summit', 'emarketer', 'predictions']",0.0
RBA's Bullock Says Rate Calls a Month-by-Month Prospect Til 2024,Aug 29,,"['rbas', 'bullock', 'says', 'rate', 'calls', 'monthbymonth', 'prospect', 'til']",0.296
Fed Set to Double Its Economic Growth Forecast After Strong US Data,Sep 6,,"['fed', 'set', 'double', 'economic', 'growth', 'forecast', 'strong', 'us', 'data']",0.7096
When will the Bank of Canada start cutting interest rates?,Sep 7,,"['bank', 'canada', 'start', 'cutting', 'interest', 'rates']",0.3612
OPEC sticks to oil demand growth view citing resilient economy,Sep 12,,"['opec', 'sticks', 'oil', 'demand', 'growth', 'view', 'citing', 'resilient', 'economy']",0.2732
Housing Faces Mortgage Rate Headwinds as Economic Growth ...,Sep 18,,"['housing', 'faces', 'mortgage', 'rate', 'headwinds', 'economic', 'growth']",0.3818
When will interest rates finally start to come down?,Aug 29,,"['interest', 'rates', 'finally', 'start', 'come']",0.4588
Thailand Faces Rising Global Headwinds,Sep 5,,"['thailand', 'faces', 'rising', 'global', 'headwinds']",0.0
China Slowdown Means It May Never Overtake US Economy ...,Sep 4,,"['china', 'slowdown', 'means', 'may', 'never', 'overtake', 'us', 'economy']",0.0
Gartner Forecasts MENA IT Spending to Grow 4% in 2024,Sep 20,,"['gartner', 'forecasts', 'mena', 'spending', 'grow']",0.0
Jamie Dimon says it's a 'huge mistake' to think economy will boom with so many risks out there,Sep 11,,"['jamie', 'dimon', 'says', 'huge', 'mistake', 'think', 'economy', 'boom', 'many', 'risks']",-0.296
"India fastest-growing major economy but risks persist, says Reuters poll",Sep 28,,"['india', 'fastestgrowing', 'major', 'economy', 'risks', 'persist', 'says', 'reuters', 'poll']",-0.2732
Salary Increase Budgets Hit Two-Decade High,Sep 11,,"['salary', 'increase', 'budgets', 'hit', 'twodecade', 'high']",0.3182
"Extreme heat, fires and floods threaten Europe’s economy",Sep 11,,"['extreme', 'heat', 'fires', 'floods', 'threaten', 'europes', 'economy']",-0.3818
The Top 5 Tech Trends In 2024 Everyone Must Be Ready For,Sep 11,,"['top', 'tech', 'trends', 'everyone', 'must', 'ready']",0.5106
Canadian recession imminent and could last through the first half of ...,Aug 31,,"['canadian', 'recession', 'imminent', 'could', 'last', 'first', 'half']",-0.4215
Economy in 2024: 'Next six months will be painful for households',Sep 22,,"['economy', 'next', 'six', 'months', 'painful', 'households']",-0.4404
ASSEMBLY 'ELECTION OUTLOOK' REPORT: 2024 CYCLE WILL ...,Sep 19,,"['assembly', 'election', 'outlook', 'report', 'cycle']",0.0
Fannie Mae dim on housing in new recession forecast,Aug 24,,"['fannie', 'mae', 'dim', 'housing', 'new', 'recession', 'forecast']",-0.4215
"Marvell Technology, Inc. Reports Second Quarter of Fiscal Year ...",Aug 24,,"['marvell', 'technology', 'inc', 'reports', 'second', 'quarter', 'fiscal', 'year']",0.0
Eight predictions about the Swedish economy over the next few years,Aug 24,,"['eight', 'predictions', 'swedish', 'economy', 'next', 'years']",0.0
NIM Pressure Persists at Chinese Banks Despite RRR Cuts,Sep 19,,"['nim', 'pressure', 'persists', 'chinese', 'banks', 'despite', 'rrr', 'cuts']",-0.0803
3 Reasons Why Stocks Will BOMB in 2024,Sep 11,,"['reasons', 'stocks', 'bomb']",-0.4939
"Dollar to stay bright this year before fading in 2024, Reuters poll of ...",Sep 7,,"['dollar', 'stay', 'bright', 'year', 'fading', 'reuters', 'poll']",0.4404
Stock Market Outlook: 2023 Rally Is Over and Fed Easing Unlikely,Aug 24,,"['stock', 'market', 'outlook', 'rally', 'fed', 'easing', 'unlikely']",0.25
Container Shipping Volumes to Grow Significantly in 2024,Sep 7,,"['container', 'shipping', 'volumes', 'grow', 'significantly']",0.0
"Türkiye revises medium-term inflation, growth forecasts",Sep 7,,"['trkiye', 'revises', 'mediumterm', 'inflation', 'growth', 'forecasts']",0.3818
"Los mejores memes de las Elecciones 2023, minuto a minuto",7 minutes ago,2023-10-22 12:37:33.576388,"['los', 'mejores', 'memes', 'de', 'las', 'elecciones', 'minuto', 'minuto']",0.0
"Río Negro en elecciones 2023, minuto a minuto: ""Argentina necesita gente normal y equilibrada"", dijo Di Giácomo",9 minutes ago,2023-10-22 12:35:33.588207,"['ro', 'negro', 'en', 'elecciones', 'minuto', 'minuto', 'argentina', 'necesita', 'gente', 'normal', 'equilibrada', 'dijo', 'di', 'gicomo']",0.0
Elecciones 2023: en España hay demoras y largas colas para votar,19 minutes ago,2023-10-22 12:25:33.570923,"['elecciones', 'en', 'espaa', 'hay', 'demoras', 'largas', 'colas', 'para', 'votar']",0.0
"Elecciones 2023, en vivo: Ya votó el 29,6% del padrón",35 minutes ago,2023-10-22 12:09:33.572925,"['elecciones', 'en', 'vivo', 'ya', 'vot', 'el', 'del', 'padrn']",0.0
"Con los ojos en Milei, Argentina busca a un líder que la saque de la aguda crisis",41 minutes ago,2023-10-22 12:03:33.589228,"['con', 'los', 'ojos', 'en', 'milei', 'argentina', 'busca', 'un', 'lder', 'que', 'la', 'saque', 'de', 'la', 'aguda', 'crisis']",-0.6249
"Elecciones 2023, EN VIVO: toda la cobertura y el minuto a minuto de los comicios",44 minutes ago,2023-10-22 12:00:33.582427,"['elecciones', 'en', 'vivo', 'toda', 'la', 'cobertura', 'el', 'minuto', 'minuto', 'de', 'los', 'comicios']",0.0
Elecciones presidenciales 2023 | El análisis en vivo en un domingo clave,46 minutes ago,2023-10-22 11:58:33.580433,"['elecciones', 'presidenciales', 'el', 'anlisis', 'en', 'vivo', 'en', 'un', 'domingo', 'clave']",0.0
"◉ Elecciones 2023 en Buenos Aires: quién va ganando, boca de urna y resultados",57 minutes ago,2023-10-22 11:47:33.573924,"['elecciones', 'en', 'buenos', 'aires', 'quin', 'va', 'ganando', 'boca', 'de', 'urna', 'resultados']",0.0
Elecciones Argentina 2023: expresidente Mauricio Macri prevé una segunda vuelta electoral,1 hour ago,2023-10-22 11:44:33.582427,"['elecciones', 'argentina', 'expresidente', 'mauricio', 'macri', 'prev', 'una', 'segunda', 'vuelta', 'electoral']",0.0
"Elecciones 2023: dónde voto, candidatos, discursos y resultados, minuto a minuto",1 hour ago,2023-10-22 11:44:33.573924,"['elecciones', 'dnde', 'voto', 'candidatos', 'discursos', 'resultados', 'minuto', 'minuto']",0.0
Ver online LN+: así se pueden seguir en vivo las Elecciones Argentina 2023,1 hour ago,2023-10-22 11:44:33.570923,"['ver', 'online', 'ln', 'se', 'pueden', 'seguir', 'en', 'vivo', 'las', 'elecciones', 'argentina']",0.0
"Elecciones en Argentina 2023, en vivo: votaciones y noticias de Massa, Milei, Bullrich y más",1 hour ago,2023-10-22 11:44:33.569924,"['elecciones', 'en', 'argentina', 'en', 'vivo', 'votaciones', 'noticias', 'de', 'massa', 'milei', 'bullrich', 'ms']",0.0
En directo: Ya comenzó la votación en Argentina para la primera ...,2 hours ago,2023-10-22 10:44:33.585169,"['en', 'directo', 'ya', 'comenz', 'la', 'votacin', 'en', 'argentina', 'para', 'la', 'primera']",0.0
Elecciones Argentina 2023: ¿dónde toca votar a los argentinos en Uruguay?,2 hours ago,2023-10-22 10:44:33.574947,"['elecciones', 'argentina', 'dnde', 'toca', 'votar', 'los', 'argentinos', 'en', 'uruguay']",0.0
Resultados Elecciones 2023: cómo van y a qué hora se dirá quién gana,2 hours ago,2023-10-22 10:44:33.571954,"['resultados', 'elecciones', 'cmo', 'van', 'qu', 'hora', 'se', 'dir', 'quin', 'gana']",0.0
Argentina Elige 2023: Jaldo confía en que habrá balotaje,3 hours ago,2023-10-22 09:44:33.594966,"['argentina', 'elige', 'jaldo', 'confa', 'en', 'que', 'habr', 'balotaje']",0.0
Elecciones 2023: abrieron las mesas y los rosarinos ya votan para elegir presidente,3 hours ago,2023-10-22 09:44:33.594726,"['elecciones', 'abrieron', 'las', 'mesas', 'los', 'rosarinos', 'ya', 'votan', 'para', 'elegir', 'presidente']",0.0
Elecciones 2023: el voto de los candidatos a senador por Jujuy,3 hours ago,2023-10-22 09:44:33.593733,"['elecciones', 'el', 'voto', 'de', 'los', 'candidatos', 'senador', 'por', 'jujuy']",0.0
Buen inicio de las elecciones nacionales en Bariloche,3 hours ago,2023-10-22 09:44:33.592707,"['buen', 'inicio', 'de', 'las', 'elecciones', 'nacionales', 'en', 'bariloche']",0.0
Comienza la votación en las elecciones generales en Argentina,3 hours ago,2023-10-22 09:44:33.592282,"['comienza', 'la', 'votacin', 'en', 'las', 'elecciones', 'generales', 'en', 'argentina']",0.0
Elecciones 2023: ¿qué hago si me robaron el documento ...,3 hours ago,2023-10-22 09:44:33.592064,"['elecciones', 'qu', 'hago', 'si', 'robaron', 'el', 'documento']",0.296
Elecciones en Neuquén: ya empezaron a votar los candidatos a ...,3 hours ago,2023-10-22 09:44:33.590207,"['elecciones', 'en', 'neuqun', 'ya', 'empezaron', 'votar', 'los', 'candidatos']",0.0
"Elecciones 2023, EN VIVO: seguí la cobertura y el minuto a minuto de los comicios en Salta",3 hours ago,2023-10-22 09:44:33.590207,"['elecciones', 'en', 'vivo', 'segu', 'la', 'cobertura', 'el', 'minuto', 'minuto', 'de', 'los', 'comicios', 'en', 'salta']",0.0
Elecciones 2023: votó Jorge Rizzotti,3 hours ago,2023-10-22 09:44:33.590207,"['elecciones', 'vot', 'jorge', 'rizzotti']",0.0
Elecciones nacionales y contexto geopolítico,3 hours ago,2023-10-22 09:44:33.585169,"['elecciones', 'nacionales', 'contexto', 'geopoltico']",0.0
"De mal humor, Alberto Fernández se refugió en la veda",3 hours ago,2023-10-22 09:44:33.578438,"['de', 'mal', 'humor', 'alberto', 'fernndez', 'se', 'refugi', 'en', 'la', 'veda']",0.2732
Elecciones 2023: cómo se vota en CABA y por qué no se utiliza Boleta Única Electrónica,3 hours ago,2023-10-22 09:44:33.575929,"['elecciones', 'cmo', 'se', 'vota', 'en', 'caba', 'por', 'qu', 'se', 'utiliza', 'boleta', 'nica', 'electrnica']",0.0
Elecciones 2023: ¿en qué casó habrá balotaje? | CNN,3 hours ago,2023-10-22 09:44:33.573924,"['elecciones', 'en', 'qu', 'cas', 'habr', 'balotaje', 'cnn']",0.0
Qué se vota en la Argentina y cuáles son los cargos que se ...,4 hours ago,2023-10-22 08:44:33.593733,"['qu', 'se', 'vota', 'en', 'la', 'argentina', 'cules', 'son', 'los', 'cargos', 'que', 'se']",0.0
"Elecciones 2023: ""Es un gran día para Argentina"", dijo Wellbach y ...",4 hours ago,2023-10-22 08:44:33.592707,"['elecciones', 'es', 'un', 'gran', 'da', 'para', 'argentina', 'dijo', 'wellbach']",0.0
"En vivo Elecciones 2023 Mendoza: desde las 8, y con poco ...",4 hours ago,2023-10-22 08:44:33.592282,"['en', 'vivo', 'elecciones', 'mendoza', 'desde', 'las', 'con', 'poco']",0.0
Elecciones 2023: cómo cortar boleta sin que te anulen el voto,4 hours ago,2023-10-22 08:44:33.587207,"['elecciones', 'cmo', 'cortar', 'boleta', 'sin', 'que', 'te', 'anulen', 'el', 'voto']",-0.5574
"Elecciones 2023 en vivo: Javier Milei, Sergio Massa y Patricia Bullrich buscan ser el próximo presidente de Argentina",4 hours ago,2023-10-22 08:44:33.586208,"['elecciones', 'en', 'vivo', 'javier', 'milei', 'sergio', 'massa', 'patricia', 'bullrich', 'buscan', 'ser', 'el', 'prximo', 'presidente', 'de', 'argentina']",0.0
Elecciones 2023 en Catamarca en vivo: resultados y novedades ...,4 hours ago,2023-10-22 08:44:33.580433,"['elecciones', 'en', 'catamarca', 'en', 'vivo', 'resultados', 'novedades']",0.0
Elecciones 2023: qué necesita Sergio Massa para ir al balotaje,4 hours ago,2023-10-22 08:44:33.579427,"['elecciones', 'qu', 'necesita', 'sergio', 'massa', 'para', 'ir', 'al', 'balotaje']",0.0
Elecciones 2023: qué necesita Patricia Bullrich para ir al balotaje,4 hours ago,2023-10-22 08:44:33.579427,"['elecciones', 'qu', 'necesita', 'patricia', 'bullrich', 'para', 'ir', 'al', 'balotaje']",0.0
"Elecciones 2023, en vivo: “Va a ir mucha más gente a votar que en las PASO”, pronosticó Néstor Grindetti",4 hours ago,2023-10-22 08:44:33.579427,"['elecciones', 'en', 'vivo', 'va', 'ir', 'mucha', 'ms', 'gente', 'votar', 'que', 'en', 'las', 'paso', 'pronostic', 'nstor', 'grindetti']",0.0
Dólar blue: qué pasará mañana después de las Elecciones 2023,4 hours ago,2023-10-22 08:44:33.578438,"['dlar', 'blue', 'qu', 'pasar', 'maana', 'despus', 'de', 'las', 'elecciones']",0.0
¿Es feriado este 23 de octubre tras las Elecciones 2023?,4 hours ago,2023-10-22 08:44:33.578438,"['es', 'feriado', 'este', 'de', 'octubre', 'tras', 'las', 'elecciones']",0.0
Abren los centros de votación para las elecciones en Argentina,4 hours ago,2023-10-22 08:44:33.576388,"['abren', 'los', 'centros', 'de', 'votacin', 'para', 'las', 'elecciones', 'en', 'argentina']",0.0
Elecciones 2023: ¿Abren los supermercados este domingo 22 de octubre en Argentina?,4 hours ago,2023-10-22 08:44:33.572925,"['elecciones', 'abren', 'los', 'supermercados', 'este', 'domingo', 'de', 'octubre', 'en', 'argentina']",0.0
Elecciones 2023. Abrieron los comicios: Argentina elige a su presidente y en Santa Cruz a las autoridades locales,5 hours ago,2023-10-22 07:44:33.590207,"['elecciones', 'abrieron', 'los', 'comicios', 'argentina', 'elige', 'su', 'presidente', 'en', 'santa', 'cruz', 'las', 'autoridades', 'locales']",0.0
"Elecciones en La Plata 2023, EN VIVO: Arranca la votación para intendente, dónde voto, los candidatos y todo lo que tenés que saber",5 hours ago,2023-10-22 07:44:33.588207,"['elecciones', 'en', 'la', 'plata', 'en', 'vivo', 'arranca', 'la', 'votacin', 'para', 'intendente', 'dnde', 'voto', 'los', 'candidatos', 'todo', 'lo', 'que', 'tens', 'que', 'saber']",0.0
Elecciones 2023: a qué hora llegan las lluvias este domingo a ...,5 hours ago,2023-10-22 07:44:33.587207,"['elecciones', 'qu', 'hora', 'llegan', 'las', 'lluvias', 'este', 'domingo']",0.0
Elecciones 2023: cómo funcionará el transporte público - Agencia Noticias Argentinas NA,5 hours ago,2023-10-22 07:44:33.584191,"['elecciones', 'cmo', 'funcionar', 'el', 'transporte', 'pblico', 'agencia', 'noticias', 'argentinas', 'na']",0.0
Tapas de diarios del domingo 22 de octubre de 2023: elecciones ...,5 hours ago,2023-10-22 07:44:33.581428,"['tapas', 'de', 'diarios', 'del', 'domingo', 'de', 'octubre', 'de', 'elecciones']",0.0
Elecciones 2023 en Buenos Aires en VIVO: resultados y novedades minuto a minuto,5 hours ago,2023-10-22 07:44:33.580433,"['elecciones', 'en', 'buenos', 'aires', 'en', 'vivo', 'resultados', 'novedades', 'minuto', 'minuto']",0.0
Cómo son todas las boletas de las elecciones 2023: así se ...,5 hours ago,2023-10-22 07:44:33.575929,"['cmo', 'son', 'todas', 'las', 'boletas', 'de', 'las', 'elecciones', 'se']",0.0
"Alberto Fernández votó en Puerto Madero: ""No importa si me retiro ...",5 hours ago,2023-10-22 07:44:33.572925,"['alberto', 'fernndez', 'vot', 'en', 'puerto', 'madero', 'importa', 'si', 'retiro']",0.0
¿Hasta qué hora se puede votar en las Elecciones 2023 de hoy 22 de octubre?,5 hours ago,2023-10-22 07:44:33.569924,"['hasta', 'qu', 'hora', 'se', 'puede', 'votar', 'en', 'las', 'elecciones', 'de', 'hoy', 'de', 'octubre']",0.0
Paraguay sigue atento elecciones en Argentina – El Nacional,6 hours ago,2023-10-22 06:44:33.591210,"['paraguay', 'sigue', 'atento', 'elecciones', 'en', 'argentina', 'el', 'nacional']",0.0
Elecciones en Argentina: lo que hay que saber,6 hours ago,2023-10-22 06:44:33.571954,"['elecciones', 'en', 'argentina', 'lo', 'que', 'hay', 'que', 'saber']",0.0
Documentos válidos para votar hoy en las elecciones Argentina 2023,6 hours ago,2023-10-22 06:44:33.570923,"['documentos', 'vlidos', 'para', 'votar', 'hoy', 'en', 'las', 'elecciones', 'argentina']",0.0
